{
  "version": 2,
  "sequence": ["client-dashboard", "resident-portal", "scanner-app"],
  "focusedApp": "client-dashboard",
  "integratedPilot": {
    "stage": "parked",
    "certificationReceipt": null
  },
  "apps": {
    "client-dashboard": {
      "stage": "focused",
      "currentPlan": "gateflow_workflow_bootstrap",
      "baseline": null,
      "evidence": [],
      "certificationReceipt": null,
      "selection": {
        "command": "/audit all",
        "agent": "gateflow-guide",
        "skills": ["gf-guide"],
        "cli": "cursor"
      },
      "pilotFlowCoverage": {
        "covered": 0,
        "total": 9,
        "status": "not-started"
      },
      "delivery": null,
      "pageScoresFile": null,
      "updatedAt": "2026-07-24T03:10:00.000Z"
    },
    "resident-portal": {
      "stage": "parked",
      "currentPlan": null,
      "baseline": null,
      "evidence": [],
      "certificationReceipt": null,
      "updatedAt": "2026-07-24T00:00:00.000Z"
    },
    "scanner-app": {
      "stage": "parked",
      "currentPlan": null,
      "baseline": null,
      "evidence": [],
      "certificationReceipt": null,
      "updatedAt": "2026-07-24T00:00:00.000Z"
    }
  },
  "workdirLock": null,
  "createdAt": "2026-07-24T00:00:00.000Z",
  "updatedAt": "2026-07-24T00:00:00.000Z"
}
